{
  "approvals": [
    {
      "commit_sha": "dddddddddddddddddddddddddddddddddddddddd",
      "independent": true,
      "reviewer": "human-reviewer",
      "state": "APPROVED",
      "timestamp": "2026-07-11T12:40:00+00:00"
    }
  ],
  "audit": {
    "existing_work_freeze": {
      "audit_completed": false,
      "audit_required": true,
      "blocks_publication": true,
      "known_open_pr_count": 10,
      "status": "active"
    }
  },
  "commands": [
    {
      "argv": [
        "python3",
        "scripts/validate_repo.py"
      ],
      "category": "validation",
      "command_id": "repo.validate",
      "cwd": "/repo",
      "exit_code": 0,
      "finished_at": "2026-07-11T12:22:00+00:00",
      "phase": "pre_merge",
      "registry_id": "repo.validate",
      "started_at": "2026-07-11T12:21:00+00:00",
      "stderr_sha256": "0000000000000000000000000000000000000000000000000000000000000000",
      "stdout_sha256": "1111111111111111111111111111111111111111111111111111111111111111"
    },
    {
      "argv": [
        "python3",
        "scripts/governance/check_delivery_gate.py",
        "--check-pinning-only",
        ".github/workflows/governance.yml"
      ],
      "category": "validation",
      "command_id": "workflow.pinning",
      "cwd": "/repo",
      "exit_code": 0,
      "finished_at": "2026-07-11T12:22:00+00:00",
      "phase": "pre_merge",
      "registry_id": "workflow.pinning",
      "started_at": "2026-07-11T12:21:00+00:00",
      "stderr_sha256": "0000000000000000000000000000000000000000000000000000000000000000",
      "stdout_sha256": "1111111111111111111111111111111111111111111111111111111111111111"
    },
    {
      "argv": [
        "python3",
        "-m",
        "unittest",
        "discover",
        "-s",
        "tests"
      ],
      "category": "test",
      "command_id": "tests.all",
      "cwd": "/repo",
      "exit_code": 0,
      "finished_at": "2026-07-11T12:22:00+00:00",
      "phase": "pre_merge",
      "registry_id": "tests.all",
      "started_at": "2026-07-11T12:21:00+00:00",
      "stderr_sha256": "0000000000000000000000000000000000000000000000000000000000000000",
      "stdout_sha256": "1111111111111111111111111111111111111111111111111111111111111111"
    },
    {
      "argv": [
        "python3",
        "scripts/validate_repo.py"
      ],
      "category": "validation",
      "command_id": "postmerge.validate",
      "cwd": "/repo",
      "exit_code": 0,
      "finished_at": "2026-07-11T12:22:00+00:00",
      "phase": "post_merge",
      "registry_id": "postmerge.validate",
      "started_at": "2026-07-11T12:21:00+00:00",
      "stderr_sha256": "0000000000000000000000000000000000000000000000000000000000000000",
      "stdout_sha256": "1111111111111111111111111111111111111111111111111111111111111111"
    },
    {
      "argv": [
        "python3",
        "-m",
        "unittest",
        "discover",
        "-s",
        "tests"
      ],
      "category": "test",
      "command_id": "postmerge.tests",
      "cwd": "/repo",
      "exit_code": 0,
      "finished_at": "2026-07-11T12:22:00+00:00",
      "phase": "post_merge",
      "registry_id": "postmerge.tests",
      "started_at": "2026-07-11T12:21:00+00:00",
      "stderr_sha256": "0000000000000000000000000000000000000000000000000000000000000000",
      "stdout_sha256": "1111111111111111111111111111111111111111111111111111111111111111"
    }
  ],
  "generated_at": "2026-07-11T12:30:00+00:00",
  "issue": {
    "canonical_status": "status:in_progress",
    "labels": [
      "type:implementation",
      "status:in_progress"
    ],
    "numbers": [
      23
    ]
  },
  "manifest_id": "00000000-0000-0000-0000-000000000001",
  "passes": {
    "candidate_sha": "dddddddddddddddddddddddddddddddddddddddd",
    "implementation_pass_ids": [
      "impl-g1-0001"
    ],
    "ordering": [
      "impl-g1-0001"
    ],
    "parent_pass_id": "",
    "pass_records": [
      {
        "agent_id": "agent-implementer-g1",
        "base_sha": "cccccccccccccccccccccccccccccccccccccccc",
        "candidate_sha": "dddddddddddddddddddddddddddddddddddddddd",
        "candidate_tree_oid": "eeeeeeeeeeeeeeeeeeeeeeeeeeeeeeeeeeeeeeee",
        "finished_at": "2026-07-11T12:00:00+00:00",
        "model_profile": "implementer_candidate",
        "pass_id": "impl-g1-0001",
        "role": "implementer",
        "role_run_id": "impl-role-g1-0001",
        "started_at": "2026-07-11T11:45:00+00:00"
      }
    ],
    "remediation_pass_ids": []
  },
  "policy": {
    "checkout": {
      "candidate_path": "/runner/work/candidate",
      "policy_path": "/runner/work/policy",
      "separate": true
    },
    "generator_path": "scripts/governance/collect_evidence.py",
    "generator_sha256": "bbbbbbbbbbbbbbbbbbbbbbbbbbbbbbbbbbbbbbbbbbbbbbbbbbbbbbbbbbbbbbbb",
    "ref": "refs/heads/main",
    "sha": "aaaaaaaaaaaaaaaaaaaaaaaaaaaaaaaaaaaaaaaa",
    "trusted_runner": false,
    "workflow": {
      "path": ".github/workflows/governance.yml",
      "pinned": true,
      "ref": "refs/heads/main",
      "sha": "aaaaaaaaaaaaaaaaaaaaaaaaaaaaaaaaaaaaaaaa"
    }
  },
  "publication": {
    "merge_result_sha": "",
    "post_merge_tests": [],
    "post_merge_validations": [],
    "publication_sha": ""
  },
  "pull_request": {
    "author": "somebloke1",
    "base": "main",
    "draft_state": false,
    "head_ref": "issue-23-governance-correction",
    "head_sha": "dddddddddddddddddddddddddddddddddddddddd",
    "is_stacked": false,
    "linked_issues": [
      23
    ],
    "number": 23,
    "title": "fix: implement governance correction"
  },
  "qa": {
    "records": [
      {
        "agent_id": "agent-qa-g1",
        "base_sha": "cccccccccccccccccccccccccccccccccccccccc",
        "candidate_sha": "dddddddddddddddddddddddddddddddddddddddd",
        "candidate_tree_oid": "eeeeeeeeeeeeeeeeeeeeeeeeeeeeeeeeeeeeeeee",
        "event_log_hash": "2222222222222222222222222222222222222222222222222222222222222222",
        "isolation_proof": {
          "ambient_credentials_available": false,
          "candidate_tree_after": "eeeeeeeeeeeeeeeeeeeeeeeeeeeeeeeeeeeeeeee",
          "candidate_tree_before": "eeeeeeeeeeeeeeeeeeeeeeeeeeeeeeeeeeeeeeee",
          "context_files_disabled": true,
          "extensions_disabled": true,
          "gh_config_mounted": false,
          "host_home_mounted": false,
          "scratch_separate_from_source": true,
          "skills_disabled": true,
          "source_mount_read_only": true,
          "ssh_config_mounted": false,
          "themes_disabled": true,
          "write_tools_observed": false
        },
        "model_profile": "qa_primary",
        "protected_execution_record": {
          "actual_invocation": {
            "argv": [
              "pi",
              "--mode",
              "json",
              "@",
              "/tmp/prompt.md"
            ],
            "argv_sha256": "aaaaaaaaaaaaaaaaaaaaaaaaaaaaaaaaaaaaaaaaaaaaaaaaaaaaaaaaaaaaaaaa",
            "base_sha": "cccccccccccccccccccccccccccccccccccccccc",
            "candidate_sha": "dddddddddddddddddddddddddddddddddddddddd",
            "candidate_tree_oid": "eeeeeeeeeeeeeeeeeeeeeeeeeeeeeeeeeeeeeeee",
            "environment_name_allowlist": [
              "HOME",
              "PI_TELEMETRY",
              "PI_SKIP_VERSION_CHECK"
            ],
            "environment_values_recorded": false,
            "exit_code": 0,
            "finished_at": "2026-07-11T12:20:00+00:00",
            "isolation": {
              "ambient_credentials_available": false,
              "candidate_tree_after": "eeeeeeeeeeeeeeeeeeeeeeeeeeeeeeeeeeeeeeee",
              "candidate_tree_before": "eeeeeeeeeeeeeeeeeeeeeeeeeeeeeeeeeeeeeeee",
              "context_files_disabled": true,
              "extensions_disabled": true,
              "gh_config_mounted": false,
              "host_home_mounted": false,
              "scratch_separate_from_source": true,
              "skills_disabled": true,
              "source_mount_read_only": true,
              "ssh_config_mounted": false,
              "themes_disabled": true,
              "write_tools_observed": false
            },
            "pi_version": "pi 1.0.0",
            "policy_commit_sha": "aaaaaaaaaaaaaaaaaaaaaaaaaaaaaaaaaaaaaaaa",
            "profile_hash": "bd3e19338b7a6708a2c7c387404c31f74114acde64e3fe4ca9d879048dd280ce",
            "profile_id": "qa_primary",
            "qa_event_log_sha256": "2222222222222222222222222222222222222222222222222222222222222222",
            "resolved_model": "openai-codex/gpt-5.6-terra",
            "started_at": "2026-07-11T12:07:00+00:00",
            "stderr_sha256": "0000000000000000000000000000000000000000000000000000000000000000",
            "stdout_sha256": "1111111111111111111111111111111111111111111111111111111111111111",
            "tools": [
              "read",
              "grep",
              "find",
              "ls"
            ]
          },
          "evidence_class": "authoritative",
          "generated_by": {
            "dispatcher_path": "scripts/governance/run_isolated_pi.py",
            "dispatcher_sha256": "8888888888888888888888888888888888888888888888888888888888888888",
            "policy_commit_sha": "aaaaaaaaaaaaaaaaaaaaaaaaaaaaaaaaaaaaaaaa"
          },
          "qa_for_pass_id": "impl-g1-0001",
          "record_id": "00000000-0000-0000-0000-0000000000aa",
          "record_only": false,
          "role": "qa",
          "role_run_id": "qa-role-g1-0001",
          "run_id": "00000000-0000-0000-0000-000000000002",
          "schema_version": "1"
        },
        "protected_execution_record_sha256": "e1535965b1233c96c35390fb53ff2683352246e902804a0ce151c28eadfe2cb0",
        "protected_probe_record": {
          "base_sha": "cccccccccccccccccccccccccccccccccccccccc",
          "candidate_sha": "dddddddddddddddddddddddddddddddddddddddd",
          "candidate_tree_oid": "eeeeeeeeeeeeeeeeeeeeeeeeeeeeeeeeeeeeeeee",